{
    "$id": "https://spec.openapis.org/arazzo/1.0/schema/2024-05-29",
    "$schema": "https://json-schema.org/draft/2020-12/schema",
    "description": "The description of Arazzo specification v1.0.x documents without schema validation, as defined by https://spec.openapis.org/arazzo/v1.0.0",
    "$ref": "#/definitions/arazzoSpecification",
    "definitions": {
        "arazzoSpecification": {
            "type": "object",
            "properties": {
                "arazzo": {
                    "$ref": "#/definitions/version"
                },
                "info": {
                    "$ref": "#/definitions/infoObject"
                },
                "sourceDescriptions": {
                    "type": "array",
                    "items": {
                        "$ref": "#/definitions/sourceDescriptionObject"
                    },
                    "minItems": 1
                },
                "workflows": {
                    "type": "array",
                    "items": {
                        "$ref": "#/definitions/workflowObject"
                    },
                    "minItems": 1
                },
                "components": {
                    "$ref": "#/definitions/componentsObject"
                }
            },
            "required": [
                "arazzo",
                "info",
                "sourceDescriptions",
                "workflows"
            ]
        },
        "version": {
            "description": "specifies the version string format",
            "example": "1.0",
            "type": "string",
            "pattern": "^[0-9]+\\.[0-9]+\\.[0-9]+$",
            "minLength": 3
        },
        "infoObject": {
            "type": "object",
            "properties": {
                "title": {
                    "type": "string",
                    "minLength": 1
                },
                "summary": {
                    "type": "string"
                },
                "description": {
                    "type": "string"
                },
                "version": {
                    "type": "string"
                }
            },
            "required": [
                "title",
                "version"
            ]
        },
        "sourceDescriptionObject": {
            "type": "object",
            "properties": {
                "name": {
                    "type": "string",
                    "minLength": 3
                },
                "url": {
                    "type": "string"
                },
                "type": {
                    "type": "string",
                    "enum": [
                        "openapi",
                        "arazzo"
                    ]
                }
            },
            "required": [
                "name",
                "url"
            ]
        },
        "workflowId": {
            "type": "string",
            "pattern": "[A-Za-z0-9\\-]+"
        },
        "workflowDependsOn": {
            "oneOf": [
                {
                    "$ref": "#/definitions/workflowId"
                },
                {
                    "type": "string",
                    "pattern": "$sourceDescriptions\\..*.[A-Za-z0-9\\-]+"
                }
            ]
        },
        "outputObject": {
            "type": "object",
            "patternProperties": {
                "^[a-zA-Z0-9\\.\\-_]+$": {
                    "type": "string"
                }
            }
        },
        "workflowObject": {
            "type": "object",
            "properties": {
                "workflowId": {
                    "$ref": "#/definitions/workflowId"
                },
                "summary": {
                    "type": "string"
                },
                "description": {
                    "type": "string"
                },
                "inputs": {
                    "type": "object",
                    "$schema": "https://json-schema.org/draft/2020-12/schema"
                },
                "dependsOn": {
                    "type": "array",
                    "items": {
                        "$ref": "#/definitions/workflowDependsOn"
                    }
                },
                "steps": {
                    "type": "array",
                    "items": {
                        "$ref": "#/definitions/stepObject"
                    },
                    "minItems": 1
                },
                "successActions": {
                    "type": "array",
                    "items": {
                        "$ref": "#/definitions/successActionObject"
                    }
                },
                "failureActions": {
                    "type": "array",
                    "items": {
                        "$ref": "#/definitions/failureActionObject"
                    }
                },
                "outputs": {
                    "$ref": "#/definitions/outputObject"
                },
                "parameters": {
                    "type": "array",
                    "items": {
                        "$ref": "#/definitions/parameterObject"
                    }
                }
            },
            "required": [
                "workflowId",
                "steps"
            ]
        },
        "stepId": {
            "type": "string",
            "pattern": "[A-Za-z0-9_\\-]+"
        },
        "operationId": {
            "oneOf": [
                {
                    "type": "string"
                },
                {
                    "type": "string",
                    "pattern": "$sourceDescriptions\\..*.[A-Za-z0-9\\-]+"
                }
            ]
        },
        "stepObject": {
            "type": "object",
            "properties": {
                "description": {
                    "type": "string"
                },
                "stepId": {
                    "$ref": "#/definitions/stepId"
                },
                "operationId": {
                    "$ref": "#/definitions/operationId"
                },
                "operationPath": {
                    "type": "string"
                },
                "workflowId": {
                    "type": "string"
                },
                "parameters": {
                    "type": "array",
                    "items": {
                        "$ref": "#/definitions/parameterObject"
                    }
                },
                "requestBody": {
                    "$ref": "#/definitions/requestBodyObject"
                },
                "successCriteria": {
                    "type": "array",
                    "items": {
                        "$ref": "#/definitions/criterionObject"
                    }
                },
                "onSuccess": {
                    "type": "array",
                    "items": {
                        "$ref": "#/definitions/successActionObject"
                    }
                },
                "onFailure": {
                    "type": "array",
                    "items": {
                        "$ref": "#/definitions/failureActionObject"
                    }
                },
                "outputs": {
                    "$ref": "#/definitions/outputObject"
                }
            },
            "required": [
                "stepId"
            ]
        },
        "payloadObject": {
            "oneOf": [
                {
                    "type": "array"
                },
                {
                    "type":"boolean"
                },
                {
                    "type":"integer"
                },
                {
                    "type":"null"
                },
                {
                    "type":"number"
                },
                {
                    "type":"object"
                },
                {
                    "type": "string"
                }
            ]
        },
       
        "requestBodyObject": {
            "type": "object",
            "properties": {
                "contentType": {
                    "type": "string"
                },
                "payload": {
                     "$ref": "#/definitions/payloadObject"
                },
                "replacements": {
                    "type": "array",
                    "items": {
                        "$ref": "#/definitions/replacementObject"
                    }
                }
            }
        },
        "replacementObject": {
            "type": "object",
            "properties": {
                "target": {
                    "type": "string"
                },
                "value": {
                    "patternProperties": {
                        "^.+$": {
                            "type": "string"
                        }
                    }
                }
            },
            "required": [
                "target",
                "value"
            ]
        },
        "criterionObject": {
            "type": "object",
            "properties": {
                "context": {
                    "type": "string",
                    "description": "conform to the runtime expression"
                },
                "condition": {
                    "type": "string"
                },
                "type": {
                    "$ref": "#/definitions/criterionObjectType"
                }
            },
            "required": [
                "condition"
            ]
        },
        "criterionObjectType": {
            "oneOf": [
                {
                    "type": "string",
                    "enum": [
                        "simple",
                        "regex",
                        "jsonpath",
                        "xpath"
                    ]
                },
                {
                    "$ref": "#/definitions/criterionExpressionTypeObject"
                }
            ]
        },
        "criterionExpressionTypeObject": {
            "type": "object",
            "properties": {
                "type": {
                    "type": "string",
                    "enum": [
                        "jsonpath",
                        "xpath"
                    ]
                },
                "version": {
                    "type": "string",
                    "enum": [
                        "draft-goessner-dispatch-jsonpath-00",
                        "xpath-30",
                        "xpath-20",
                        "xpath-10"
                    ]
                }
            },
            "required": [
                "type",
                "version"
            ]
        },
        "workflowIdRef": {
            "oneOf": [
                {
                    "$ref": "#/definitions/workflowId"
                },
                {
                    "type": "string",
                    "pattern": "$sourceDescriptions\\..*.[A-Za-z0-9\\-]+"
                }
            ]
        },
        "successActionObject": {
            "type": "object",
            "properties": {
                "name": {
                    "type": "string"
                },
                "type": {
                    "type": "string",
                    "enum": [
                        "end",
                        "goto"
                    ]
                },
                "workflowId": {
                    "$ref": "#/definitions/workflowIdRef"
                },
                "criteria": {
                    "type": "array",
                    "items": {
                        "$ref": "#/definitions/criterionObject"
                    }
                }
            },
            "required": [
                "name",
                "type"
            ]
        },
        "failureActionObject": {
            "type": "object",
            "properties": {
                "name": {
                    "type": "string"
                },
                "type": {
                    "type": "string",
                    "enum": [
                        "end",
                        "retry",
                        "goto"
                    ]
                },
                "workflowId": {
                    "$ref": "#/definitions/workflowIdRef"
                },
                "retryAfter": {
                    "type": "number"
                },
                "retryLimit": {
                    "type": "integer"
                },
                "criteria": {
                    "type": "array",
                    "items": {
                        "$ref": "#/definitions/criterionObject"
                    }
                }
            },
            "required": [
                "name",
                "type"
            ]
        },
        "parameterObject": {
            "type": "object",
            "properties": {
                "name": {
                    "type": "string"
                },
                "in": {
                    "type": "string",
                    "enum": [
                        "path",
                        "query",
                        "header",
                        "cookie",
                        "body"
                    ]
                },
                "value": {
                    "patternProperties": {
                        "^.+$": {
                            "type": "string"
                        }
                    }
                }
            },
            "required": [
                "name",
                "value"
            ]
        },
        "componentsObject": {
            "type": "object",
            "properties": {
                "inputs": {
                    "patternProperties": {
                        "^.+$": {
                            "$schema": "https://json-schema.org/draft/2020-12/schema"
                        }
                    }
                },
                "parameters": {
                    "patternProperties": {
                        "^.+$": {
                            "$ref": "#/definitions/parameterObject"
                        }
                    }
                },
                "successActions": {
                    "patternProperties": {
                        "^.+$": {
                            "$ref": "#/definitions/successActionObject"
                        }
                    }
                },
                "failureActions": {
                    "patternProperties": {
                        "^.+$": {
                            "$ref": "#/definitions/failureActionObject"
                        }
                    }
                }
            }
        }
    }
}